{
  "$schema": "https://openpresenter.dev/schemas/theme-v1.json",
  "format": "open-presenter-theme",
  "version": 1,
  "exportedAt": "2026-10-19T13:25:00.000Z",
  "theme": {
    "title": "Louvor Clean Minimal",
    "category": "theme",
    "css": {
      "background": "radial-gradient(circle at 50% 120%, #1e293b 0%, #0f172a 50%, #020617 100%)"
    },
    "elements": [
      {
        "id": "cabecalho",
        "type": "TEXT",
        "x": 10,
        "y": 6,
        "visible": true,
        "locked": false,
        "text": "{title} <span style=\"color:#94a3b8;font-size:0.85em\">• {section}</span>",
        "css": {
          "top": "6%",
          "left": "10%",
          "width": "80%",
          "height": "6%",
          "textAlign": "center",
          "fontSize": "24px",
          "fontWeight": "600",
          "letterSpacing": "3px",
          "textTransform": "uppercase",
          "color": "#e2e8f0",
          "textShadow": "0 2px 8px rgba(0,0,0,0.8)"
        }
      },
      {
        "id": "letra",
        "type": "TEXT",
        "x": 8,
        "y": 20,
        "visible": true,
        "locked": false,
        "text": "{lyrics}",
        "css": {
          "top": "20%",
          "left": "8%",
          "width": "84%",
          "height": "62%",
          "textAlign": "center",
          "fontSize": "58px",
          "fontWeight": "700",
          "lineHeight": "1.3",
          "color": "#ffffff",
          "textShadow": "0 3px 16px rgba(0,0,0,0.9)",
          "whiteSpace": "pre-wrap",
          "autoShrink": "true"
        }
      },
      {
        "id": "proximo",
        "type": "TEXT",
        "x": 10,
        "y": 88,
        "visible": true,
        "locked": false,
        "text": "{next_preview}",
        "css": {
          "top": "88%",
          "left": "10%",
          "width": "80%",
          "height": "5%",
          "textAlign": "center",
          "fontSize": "19px",
          "fontWeight": "500",
          "color": "#94a3b8",
          "whiteSpace": "nowrap",
          "overflow": "hidden",
          "textOverflow": "ellipsis",
          "textShadow": "0 1px 4px rgba(0,0,0,0.8)"
        }
      }
    ]
  }
}
